{
  "schemaVersion": 2, "title": "Two-service capability audit", "subtitle": "Two services compared across collection, analysis, and delivery.", "generatedAt": "2026-08-15", "source": {"label": "Internal assessment", "path": "audit.md"}, "scale": {"min": 0, "max": 3, "labels": {"0": "absent", "1": "partial", "2": "working", "3": "mature"}},
  "dimensions": [{"id": "D1", "label": "Feed collection", "short": "Feeds", "question": "Does it collect scheduled feeds?"}, {"id": "D2", "label": "Document intake", "short": "Files", "question": "Does it accept documents?"}, {"id": "D3", "label": "Result delivery", "short": "Deliver", "question": "Does it deliver results?"}],
  "stages": [{"id": "collect", "label": "Collect data", "dimensionIds": ["D1", "D2"], "best": "harbor", "optimal": "Use Harbor for scheduled feeds and file intake because it covers both collection steps."}, {"id": "deliver", "label": "Deliver results", "dimensionIds": ["D3"], "best": "beacon", "optimal": "Use Beacon for delivery because it sends a clear digest to the chosen destination."}],
  "subjects": [
    {"id": "harbor", "name": "Harbor", "oneLiner": "A scheduled intake service.", "kind": "plugin", "kindNote": "Runs as a local service.", "plain": {"whatItDoes": "Collects RSS feeds hourly. It accepts uploaded documents for later processing.", "howUsed": "A person adds a source or uploads a document. An agent can request the collected items.", "unique": "It combines scheduled feeds with document intake."}, "health": {"state": "ok", "summary": "Checks complete.", "lastCommit": "2026-08-15", "tests": "8 checks pass"}, "pipeline": {"overview": "Harbor collects sources on a schedule. It stores normalized items for another service to use.", "effectiveness": {"score": 3, "why": "It covers both collection paths reliably."}, "flow": [{"stage": "collect", "how": "Collects feeds and accepts documents.", "effectiveness": 3, "why": "Both sources are ready for downstream work."}]}, "scores": {"D1": {"score": 3, "evidence": "Scheduled feed worker runs hourly.", "cite": "collector.py:20", "mark": "verified", "plain": "It collects RSS feeds hourly and retains the latest items."}, "D2": {"score": 3, "evidence": "Upload endpoint accepts documents.", "cite": "intake.py:44", "mark": "verified", "plain": "It accepts documents and records their contents for processing."}, "D3": {"score": 1, "evidence": "Exports are manual.", "cite": "export.py:12", "mark": "inferred", "plain": "It can export results, but it does not send them automatically."}}, "strengths": [], "gaps": [], "reuse": [], "role": "Collection foundation."},
    {"id": "beacon", "name": "Beacon", "oneLiner": "A concise digest service.", "kind": "app", "kindNote": "Runs in a browser.", "plain": {"whatItDoes": "Builds readable result digests. It sends the digest to a chosen destination.", "howUsed": "A person selects collected items and requests a digest. An agent can supply the selected items.", "unique": "It turns selected items into a delivered digest."}, "health": {"state": "ok", "summary": "Checks complete.", "lastCommit": "2026-08-15", "tests": "6 checks pass"}, "pipeline": {"overview": "Beacon receives prepared items. It creates and delivers a digest for review.", "effectiveness": {"score": 2, "why": "Delivery is reliable but collection depends on another service."}, "flow": [{"stage": "deliver", "how": "Builds and sends a digest.", "effectiveness": 3, "why": "Recipients receive a readable summary."}]}, "scores": {"D1": {"score": 0, "evidence": "No feed worker exists.", "cite": "app.py:9", "mark": "verified", "plain": "It does not collect feeds."}, "D2": {"score": 1, "evidence": "Accepts prepared text only.", "cite": "input.py:18", "mark": "verified", "plain": "It accepts prepared text but not source documents."}, "D3": {"score": 3, "evidence": "Digest sender is enabled.", "cite": "delivery.py:61", "mark": "verified", "plain": "It creates a digest and sends it to the selected destination."}}, "strengths": [], "gaps": [], "reuse": [], "role": "Delivery foundation."}
  ], "overlaps": [], "gaps": [], "findings": [],
  "recommendation": {"bottomLine": "Combine Harbor collection with Beacon delivery. The two services cover the full flow without duplicating collection.", "spine": "Harbor then Beacon.", "layers": [{"name": "Collect", "donors": ["Harbor"], "new": "No net-new build."}], "flow": [{"stage": "collect", "title": "Collect", "approach": "existing", "source": "Harbor", "what": "Collect feeds and documents.", "why": "It covers both collection paths."}, {"stage": "deliver", "title": "Deliver", "approach": "existing", "source": "Beacon", "what": "Create and send a digest.", "why": "It supplies the strongest delivery step."}], "nextActions": ["Connect Harbor output to Beacon input."]}, "confidence": {"context": "high", "verification": "high", "evidence": "high", "overall": "high", "note": "The fixture is synthetic."}
}
